{
    "$schema": "https://json-schema.org/draft-07/schema",
    "$id": "entitySchema",
    "title": "Source System Schema",
    "description": "Defines the structure of the source system contract.",
    "type": "object",
    "required": ["name", "description", "connectionDetails", "ingestion_columns"],
    "additionalProperties": false,
    "properties": {
      "$schema": {
        "description": "JSON Schema URI used for validation",
        "type": "string"
      },
      "name": {
        "description": "The name of the source system.",
        "type": "string"
      },
      "description": {
        "description": "Brief description of source system",
        "type": "string"
      },
      "connectionDetails": {
        "description": "Define how to connect to source system.",
        "type": "object",
        "required": ["connectionString", "sourceQuery"],
        "additionalProperties": false,
        "properties": {
          "connectionString": {
            "type": "string",
            "description": "Connection to data or keyvault secret."
          },
          "sourceQuery": {
            "type": "string",
            "description": "If sql_database - define query to ingest data."
          }
        }
      },
      "ingestion_columns": {
        "description": "List of columns used during ingestion",
        "type": "array",
        "minItems": 1,
        "items": {
          "type": "object",
          "required": ["sortOrder", "columnName", "dataType", "required", "primary_key"],
          "additionalProperties": false,
          "properties": {
            "sortOrder": {
              "type": "integer",
              "minimum": 0
            },
            "columnName": {
              "type": "string",
              "minLength": 1
            },
            "dataType": {
              "type": "string",
              "minLength": 1,
              "enum": [
                "byte", "short", "int", "long",
                "float", "double", "decimal",
                "string", "varchar", "char", "binary",
                "boolean", "date", "timestamp"
              ]
            },
            "required": {
              "type": "boolean"
            },
            "primary_key": {
              "type": "boolean"
            }
          }
        }
      }
    }
  }
  