{
    "name": "customer_AW",
    "description": "dim_customer",
    "connectionDetails": {
        "connectionString": "https://raw.githubusercontent.com/MicrosoftLearning/dp-203-azure-data-engineer/refs/heads/master/Allfiles/labs/03/data/2020.csv",
        "sourceQuery": "None"
    },
    "ingestion_columns": [
        {
            "sortOrder": 1,
            "columnName": "SalesOrderNumber",
            "dataType": "varchar",
            "required": false,
            "primary_key": false
        },
        {
            "sortOrder": 2,
            "columnName": "SalesOrderLineNumber",
            "dataType": "int",
            "required": false,
            "primary_key": false
        },
        {
            "sortOrder": 3,
            "columnName": "OrderDate",
            "dataType": "date",
            "required": false,
            "primary_key": false
        },
        {
            "sortOrder": 4,
            "columnName": "CustomerName",
            "dataType": "varchar",
            "required": true,
            "primary_key": false
        },
        {
            "sortOrder": 5,
            "columnName": "EmailAddress",
            "dataType": "varchar",
            "required": true,
            "primary_key": false
        },
        {
            "sortOrder": 6,
            "columnName": "Item",
            "dataType": "varchar",
            "required": false,
            "primary_key": false
        },
        {
            "sortOrder": 7,
            "columnName": "Quantity",
            "dataType": "int",
            "required": false,
            "primary_key": false
        },
        {
            "sortOrder": 8,
            "columnName": "UnitPrice",
            "dataType": "double",
            "required": false,
            "primary_key": false
        },
        {
            "sortOrder": 9,
            "columnName": "TaxAmount",
            "dataType": "double",
            "required": false,
            "primary_key": false
        }
    ]
}