{
    "$schema": "../../json_schema/_entitySchema.json",
    "name": "design",
    "description": "dim_design",
    "connectionDetails": {
        "connectionString": "totesysConnectionStringADO",
        "sourceQuery": "SELECT * FROM design"
    },
    "ingestion_columns": [
        {
            "sortOrder": 1,
            "columnName": "design_id",
            "dataType": "int",
            "required": true,
            "primary_key": true
        },
        {
            "sortOrder": 2,
            "columnName": "created_at",
            "dataType": "date",
            "required": false,
            "primary_key": false
        },
        {
            "sortOrder": 3,
            "columnName": "design_name",
            "dataType": "string",
            "required": true,
            "primary_key": true
        },
        {
            "sortOrder": 4,
            "columnName": "file_location",
            "dataType": "string",
            "required": true,
            "primary_key": false
        },
        {
            "sortOrder": 5,
            "columnName": "file_name",
            "dataType": "string",
            "required": true,
            "primary_key": false
        },
        {
            "sortOrder": 6,
            "columnName": "last_updated",
            "dataType": "date",
            "required": false,
            "primary_key": false
        }
    ]
}