{
    "name": "department",
    "description": "Description of the department entity",
    "connectionDetails": {
      "connectionString": "connectionStringTotesys",
      "sourceQuery": "SELECT * FROM department"
    },
    "ingestion_columns": [
      {
        "sortOrder": 1,
        "columnName": "department_id",
        "dataType": "int",
        "required": true,
        "primary_key": true
      },
      {
        "sortOrder": 2,
        "columnName": "department_name",
        "dataType": "string",
        "required": true,
        "primary_key": false
      },
      {
        "sortOrder": 3,
        "columnName": "location",
        "dataType": "string",
        "required": true,
        "primary_key": false
      },
      {
        "sortOrder": 4,
        "columnName": "manager",
        "dataType": "string",
        "required": true,
        "primary_key": false
      },
      {
        "sortOrder": 5,
        "columnName": "created_At",
        "dataType": "date",
        "required": true,
        "primary_key": false
      },
      {
        "sortOrder": 6,
        "columnName": "last_updated",
        "dataType": "date",
        "required": true,
        "primary_key": false
      }
    ]
  }
  